{"schema_version":1,"generated_at":"2026-10-05T19:27:46Z","unit":"kWh","fx_base":"EUR","fx":{"AED":4.1283,"AFN":73.176,"ALL":92.1,"AMD":407.93,"AOA":1033.12,"ARS":1713.6,"AUD":1.6097,"AWG":2.0166,"AZN":1.9118,"BAM":1.9558,"BBD":2.2932,"BDT":138.35,"BHD":0.42266,"BIF":3389.39,"BMD":1.1241,"BND":1.4382,"BOB":13.4841,"BRL":5.5849,"BSD":1.1365,"BTN":108.14,"BWP":15.3037,"BYN":3.3874,"BZD":2.2854,"CAD":1.5969,"CDF":2577.33,"CHF":0.9311,"CLP":1109.77,"CNY":7.5118,"COP":3678.13,"CRC":516.03,"CUP":26.978,"CVE":110.26,"CZK":24.456,"DJF":199.95,"DKK":7.4745,"DOP":68.108,"DZD":150.68,"EGP":58.842,"ERN":17.1338,"ETB":181.68,"EUR":1.0,"FJD":2.5368,"FKP":0.84946,"GBP":0.8472,"GEL":2.9227,"GHS":13.1784,"GIP":0.86136,"GMD":82.47,"GNF":9926.0,"GTQ":8.6131,"GYD":237.49,"HKD":8.7925,"HNL":30.271,"HTG":147.39,"HUF":367.8,"IDR":20069.89,"ILS":3.431,"INR":107.8915,"IQD":1474.06,"IRR":1955508.0,"ISK":137.0,"JMD":177.93,"JOD":0.79699,"JPY":177.28,"KES":145.78,"KGS":98.4,"KHR":4569.75,"KMF":493.45,"KPW":146.11,"KRW":1505.8,"KWD":0.34683,"KYD":0.94109,"KZT":504.83,"LAK":25181.0,"LKR":371.75,"LRD":192.78,"LSL":18.7217,"LYD":7.2243,"MAD":11.1621,"MDL":20.027,"MGA":4995.23,"MKD":61.694,"MMK":2359.56,"MNT":4046.71,"MOP":9.0918,"MRU":45.096,"MUR":54.202,"MVR":17.3744,"MWK":1950.75,"MXN":20.3348,"MYR":4.5791,"MZN":71.693,"NAD":18.6887,"NGN":1494.79,"NIO":41.17,"NOK":10.7575,"NPR":173.24,"NZD":2.0038,"OMR":0.43222,"PEN":3.868,"PGK":5.0419,"PHP":70.219,"PKR":312.09,"PLN":4.3795,"PYG":6586.0,"QAR":4.0917,"RON":5.3363,"RSD":117.48,"RUB":94.28,"RWF":1661.3,"SAR":4.2154,"SBD":9.0324,"SCR":16.3975,"SDG":676.33,"SEK":11.2525,"SGD":1.4344,"SHP":0.84946,"SLE":26.777,"SRD":42.385,"SSP":6480.0,"STN":24.403,"SYP":137.43,"SZL":18.7138,"THB":37.752,"TJS":10.3729,"TMT":3.9344,"TND":3.3727,"TOP":2.6976,"TRY":55.0755,"TTD":7.5862,"TWD":35.77,"TZS":2963.1,"UAH":50.582,"UGX":4471.04,"USD":1.1204,"UYU":45.391,"UZS":13277.0,"VES":976.9,"VND":29169.0,"VUV":134.15,"WST":3.1079,"XAF":655.96,"XCD":3.0754,"XCG":2.0302,"XOF":655.96,"XPF":119.84,"YER":266.27,"ZAR":18.6263,"ZMW":22.164,"ZWG":30.234},"countries":{"AD":{"name":"Andorra","currency":"EUR","zone_label":null,"average":{"precision":"estimated","basis":"country-table","as_of":"2026-01","flat":0.172},"zones":[]},"AE":{"name":"United Arab Emirates","currency":"AED","zone_label":null,"average":{"precision":"estimated","basis":"country-table","as_of":"2026-09","flat":0.31},"zones":[]},"AF":{"name":"Afghanistan","currency":"AFN","zone_label":null,"average":{"precision":"estimated","basis":"country-table","as_of":"2016-03","flat":2.5},"zones":[]},"AG":{"name":"Antigua and Barbuda","currency":"XCD","zone_label":null,"average":{"precision":"estimated","basis":"country-table","as_of":"2026-10","flat":1.28},"zones":[]},"AI":{"name":"Anguilla","currency":"XCD","zone_label":null,"average":{"precision":"estimated","basis":"country-table","as_of":"2026-09","flat":1.81},"zones":[]},"AL":{"name":"Albania","currency":"ALL","zone_label":null,"average":{"precision":"estimated","basis":"country-table","as_of":"2026-10","flat":10.2},"zones":[]},"AM":{"name":"Armenia","currency":"AMD","zone_label":null,"average":{"precision":"estimated","basis":"country-table","as_of":"2026-02","flat":48.48},"zones":[]},"AO":{"name":"Angola","currency":"AOA","zone_label":null,"average":{"precision":"estimated","basis":"country-table","as_of":"2025-06","flat":16.73},"zones":[]},"AQ":{"name":"Antarctica","currency":"USD","zone_label":null,"zones":[],"average":{"precision":"estimated","basis":"educated-guess","reason":"No households live here. A guess: about what inhabited remote islands running on diesel pay (Falklands, St Helena, Norfolk Island, Cook Islands: 0.41 to 0.55 EUR/kWh).","flat":0.5602}},"AR":{"name":"Argentina","currency":"ARS","zone_label":null,"average":{"precision":"estimated","basis":"country-table","as_of":"2026-10","flat":209.97},"zones":[]},"AS":{"name":"American Samoa","currency":"USD","zone_label":null,"average":{"precision":"estimated","basis":"country-table","as_of":"2026-08","flat":0.5065},"zones":[]},"AT":{"name":"Austria","currency":"EUR","zone_label":null,"average":{"precision":"live","basis":"day-ahead","flat":0.4513,"series":{"start":"2026-10-04T22:00:00Z","step_minutes":15,"values":[0.4211,0.4106,0.4067,0.4002,0.3984,0.3899,0.3967,0.4044,0.3973,0.4051,0.4094,0.4089,0.403,0.401,0.4018,0.4023,0.4064,0.3935,0.4019,0.4106,0.3949,0.4121,0.4321,0.4553,0.4443,0.4732,0.4963,0.5115,0.5134,0.5187,0.5031,0.4874,0.5251,0.4929,0.4737,0.4589,0.4809,0.466,0.4392,0.4106,0.4337,0.4056,0.3892,0.3337,0.4242,0.4028,0.3729,0.3622,0.3062,0.3358,0.3073,0.2586,0.3881,0.3782,0.3694,0.3735,0.3101,0.3447,0.3364,0.346,0.3415,0.3855,0.3923,0.4427,0.3635,0.4322,0.4732,0.5278,0.4193,0.477,0.5057,0.5404,0.505,0.5216,0.4978,0.5368,0.5112,0.525,0.5331,0.5215,0.5229,0.5207,0.4931,0.4732,0.5022,0.477,0.4661,0.4397,0.4596,0.4464,0.4411,0.4221,0.447,0.4209,0.4145,0.4047,0.4399,0.4465,0.4432,0.4342,0.4313,0.4415,0.4432,0.4381,0.4313,0.4389,0.4415,0.4398,0.441,0.4415,0.4439,0.4497,0.4376,0.4377,0.4339,0.4313,0.4343,0.4415,0.4601,0.4555,0.4493,0.4661,0.4831,0.4935,0.5349,0.5412,0.5371,0.5404,0.5404,0.5278,0.4849,0.466,0.5021,0.4607,0.4569,0.4492,0.4462,0.3853,0.3904,0.3342,0.3279,0.3136,0.3189,0.3302,0.3115,0.3097,0.3153,0.3158,0.3118,0.3181,0.3169,0.3141,0.3168,0.3156,0.3207,0.3393,0.3645,0.3745,0.3773,0.4068,0.3782,0.4008,0.4733,0.5177,0.4376,0.4873,0.5357,0.5833,0.5307,0.5513,0.6016,0.6785,0.6455,0.6403,0.6597,0.6123,0.6038,0.5477,0.5278,0.5141,0.5209,0.507,0.5032,0.4816,0.483,0.4789,0.4673,0.4544,0.4709,0.4641,0.4433,0.4332]}},"zones":[]},"AU":{"name":"Australia","currency":"AUD","zone_label":null,"average":{"precision":"estimated","basis":"country-table","as_of":"2025-09","flat":0.41},"zones":[]},"AW":{"name":"Aruba","currency":"AWG","zone_label":null,"average":{"precision":"estimated","basis":"country-table","as_of":"2024-11","flat":0.3848},"zones":[]},"AX":{"name":"Åland Islands","currency":"EUR","zone_label":null,"average":{"precision":"estimated","basis":"country-table","as_of":"2026-11","flat":0.265},"zones":[]},"AZ":{"name":"Azerbaijan","currency":"AZN","zone_label":null,"average":{"precision":"estimated","basis":"country-table","as_of":"2026-01","flat":0.0927},"zones":[]},"BA":{"name":"Bosnia and Herzegovina","currency":"BAM","zone_label":null,"average":{"precision":"estimated","basis":"country-table","as_of":"2025-12","flat":0.189},"zones":[]},"BB":{"name":"Barbados","currency":"BBD","zone_label":null,"average":{"precision":"estimated","basis":"country-table","as_of":"2026-09","flat":0.647},"zones":[]},"BD":{"name":"Bangladesh","currency":"BDT","zone_label":null,"average":{"precision":"estimated","basis":"country-table","as_of":"2026-06","flat":7.72},"zones":[]},"BE":{"name":"Belgium","currency":"EUR","zone_label":null,"average":{"precision":"live","basis":"day-ahead","flat":0.4816,"series":{"start":"2026-10-04T22:00:00Z","step_minutes":15,"values":[0.4405,0.4444,0.4496,0.4449,0.4447,0.4342,0.4416,0.4368,0.4392,0.4318,0.4336,0.4303,0.4291,0.4282,0.4282,0.4281,0.4307,0.4297,0.4249,0.4287,0.4284,0.4315,0.4323,0.4428,0.4519,0.4728,0.4852,0.4922,0.488,0.4978,0.5111,0.5203,0.5452,0.5202,0.503,0.4828,0.517,0.4938,0.466,0.436,0.4819,0.4577,0.4333,0.4105,0.4248,0.423,0.3918,0.3838,0.4096,0.3631,0.3437,0.3168,0.38,0.3692,0.3495,0.3396,0.307,0.3241,0.3365,0.3536,0.3651,0.3848,0.3884,0.4123,0.3772,0.4162,0.4305,0.4504,0.431,0.4582,0.4834,0.4996,0.4819,0.5045,0.5158,0.5393,0.5259,0.5366,0.5522,0.5415,0.5423,0.5107,0.5019,0.4845,0.5008,0.488,0.489,0.4615,0.5027,0.4894,0.4938,0.4736,0.4742,0.4465,0.4399,0.4254,0.4414,0.4335,0.4279,0.4244,0.428,0.4269,0.4263,0.4307,0.4333,0.4289,0.4296,0.4277,0.4294,0.4294,0.429,0.4309,0.4286,0.4381,0.4318,0.4345,0.4242,0.4337,0.4495,0.4753,0.4694,0.4827,0.4894,0.5011,0.5031,0.5227,0.5297,0.5341,0.5681,0.5369,0.5239,0.4914,0.5391,0.4999,0.481,0.4353,0.4776,0.4488,0.4449,0.4281,0.4436,0.4483,0.4267,0.4168,0.4368,0.4256,0.4267,0.4118,0.4186,0.4091,0.4036,0.4066,0.4127,0.4206,0.4262,0.4277,0.4176,0.4264,0.4289,0.4417,0.4297,0.4438,0.4702,0.4977,0.4666,0.5,0.5317,0.6013,0.5562,0.5836,0.6305,0.6949,0.6697,0.6625,0.6784,0.6365,0.629,0.5794,0.5618,0.5446,0.5558,0.5338,0.527,0.5031,0.5106,0.5054,0.5046,0.497,0.4955,0.4902,0.485,0.4783]}},"zones":[]},"BF":{"name":"Burkina Faso","currency":"XOF","zone_label":null,"average":{"precision":"estimated","basis":"country-table","as_of":"2023-10","flat":120.54},"zones":[]},"BG":{"name":"Bulgaria","currency":"EUR","zone_label":null,"average":{"precision":"live","basis":"day-ahead","flat":0.2649,"series":{"start":"2026-10-04T22:00:00Z","step_minutes":15,"values":[0.3128,0.2698,0.2454,0.237,0.2327,0.2308,0.235,0.2703,0.2432,0.2847,0.2941,0.3001,0.2843,0.2799,0.2825,0.2843,0.2913,0.2532,0.2906,0.3092,0.2603,0.3065,0.3577,0.4031,0.3714,0.402,0.4228,0.3761,0.4852,0.4632,0.3508,0.3328,0.3394,0.2087,0.1735,0.0521,0.102,0.1373,0.1829,0.1451,0.0977,0.1961,0.1855,0.1583,0.1961,0.1713,0.1472,0.1367,0.1291,0.1373,0.1147,0.0774,0.1137,0.1034,0.0907,0.0856,0.1003,0.1281,0.1306,0.1442,0.1311,0.1586,0.1088,0.0941,0.1862,0.254,0.3107,0.3878,0.3269,0.4618,0.3369,0.3624,0.3549,0.3161,0.3218,0.2408,0.3866,0.3305,0.3305,0.3871,0.3989,0.393,0.3697,0.3517,0.3478,0.3375,0.3344,0.329,0.3206,0.3084,0.3028,0.2992,0.3137,0.2952,0.2903,0.2917,0.2997,0.2835,0.2767,0.2706,0.2705,0.2687,0.2705,0.2648,0.2769,0.2706,0.2686,0.2669,0.2681,0.2686,0.2724,0.2548,0.2495,0.2541,0.2506,0.2856,0.2589,0.29,0.3223,0.3433,0.3272,0.3451,0.3781,0.3841,0.3436,0.3379,0.3118,0.3386,0.3086,0.3354,0.1289,0.064,0.1781,0.1289,0.1105,0.1256,0.1289,0.1988,0.1961,0.1571,0.1466,0.1336,0.1388,0.1499,0.132,0.1296,0.1362,0.136,0.1325,0.1391,0.1384,0.1349,0.1378,0.1363,0.1397,0.1585,0.1893,0.1993,0.1439,0.2231,0.203,0.2233,0.3081,0.3623,0.2889,0.3718,0.4458,0.3701,0.3309,0.3497,0.3701,0.3761,0.4349,0.4649,0.4349,0.3982,0.3782,0.3331,0.3526,0.3555,0.3457,0.3629,0.3701,0.3643,0.3389,0.3387,0.3021,0.2792,0.3242,0.3161,0.272,0.258]}},"zones":[]},"BH":{"name":"Bahr